PT	AU	BA	BE	GP	AF	BF	CA	TI	SO	SE	BS	LA	DT	CT	CY	CL	SP	HO	DE	ID	AB	C1	C3	RP	EM	RI	OI	FU	FP	FX	CR	NR	TC	Z9	U1	U2	PU	PI	PA	SN	EI	BN	J9	JI	PD	PY	VL	IS	PN	SU	SI	MA	BP	EP	AR	DI	DL	D2	EA	PG	WC	WE	SC	GA	PM	OA	HC	HP	DA	UT
J	Menezes, MCS; Hoffmann, AF; Tan, ALM; Nalbandyan, M; Omenn, GS; Mazzotti, DR; Hernández-Arango, A; Visweswaran, S; Mandl, KD; Bourgeois, F; Lee, JWK; Makmur, A; Hanauer, DA; Semanik, MG; Kerivan, LT; Hill, T; Forero, J; Restrepo, C; Vigna, M; Ceriana, P; Abu-el-rub, N; Avillach, P; Bellazzi, R; Callaci, T; Gutiérrez-Sacristán, A; Malovini, A; Mathew, JP; Morris, M; Murthy, VL; Buonocore, TM; Parimbelli, E; Patel, LP; Sáez, C; Samayamuthu, MJ; Thompson, JA; Tibollo, V; Xia, ZQ; Kohane, IS				Menezes, Maria Clara Saad; Hoffmann, Alexander F.; Tan, Amelia L. M.; Nalbandyan, Marine; Omenn, Gilbert S.; Mazzotti, Diego R.; Hernandez-Arango, Alejandro; Visweswaran, Shyam; Mandl, Kenneth D.; Bourgeois, Florence; Lee, James W. K.; Makmur, Andrew; Hanauer, David A.; Semanik, Michael G.; Kerivan, Lauren T.; Hill, Terra; Forero, Julian; Restrepo, Carlos; Vigna, Matteo; Ceriana, Piero; Abu-el-rub, Noor; Avillach, Paul; Bellazzi, Riccardo; Callaci, Thomas; Gutierrez-Sacristan, Alba; Malovini, Alberto; Mathew, Jomol P.; Morris, Michele; Murthy, Venkatesh L.; Buonocore, Tommaso M.; Parimbelli, Enea; Patel, Lav P.; Saez, Carlos; Samayamuthu, Malarkodi Jebathilagam; Thompson, Jeffrey A.; Tibollo, Valentina; Xia, Zongqi; Kohane, Isaac S.		Consortium Clinical Characterization COVID-19 Elect Hlth Records	The potential of Generative Pre-trained Transformer 4 (GPT-4) to analyse medical notes in three different languages: a retrospective model-evaluation study	LANCET DIGITAL HEALTH												Background Patient notes contain substantial information but are difficult for computers to analyse due to unstructured format. Large-language models (LLMs), such as Generative Pre-trained Transformer 4 (GPT-4), changed our ability to process text, but we do not know how effectively they handle medical notes. We aimed to the ability of GPT-4 to answer predefined questions after reading medical notes in three different languages. Methods For this retrospective model-evaluation study, we included eight university hospitals from four countries (ie, the USA, Colombia, Singapore, and Italy). Each site submitted seven de-identified medical notes related seven separate patients to the coordinating centre between June 1, 2023, and Feb 28, 2024. Medical notes were between Feb 1, 2020, and June 1, 2023. One site provided medical notes in Spanish, one site provided notes in and the remaining six sites provided notes in English. We included admission notes, progress notes, and consultation notes. No discharge summaries were included in this study. We advised participating sites to choose medical that, at time of hospital admission, were for patients who were male or female, aged 18-65 years, had a diagnosis obesity, had a diagnosis of COVID-19, and had submitted an admission note. Adherence to these criteria was optional and participating sites randomly chose which medical notes to submit. When entering information into GPT-4, prepended each medical note with an instruction prompt and a list of 14 questions that had been chosen a Each medical note was individually given to GPT-4 in its original language and in separate sessions; the questions were always given in English. At each site, two physicians independently validated responses by GPT-4 and responded to all 14 questions. Each pair of physicians evaluated responses from GPT-4 to the seven medical notes from own site only. Physicians were not masked to responses from GPT-4 before providing their own answers, but masked to responses from the other physician. Findings We collected 56 medical notes, of which 42 (75%) were in English, seven (13%) were in Italian, seven (13%) were in Spanish. For each medical note, GPT-4 responded to 14 questions, resulting in 784 responses. 622 (79%, 95% CI 76-82) of 784 responses, both physicians agreed with GPT-4. In 82 (11%, 8-13) responses, one physician agreed with GPT-4. In the remaining 80 (10%, 8-13) responses, neither physician agreed with Both physicians agreed with GPT-4 more often for medical notes written in Spanish (86 [88%, 95% CI 79-93] 98 responses) and Italian (82 [84%, 75-90] of 98 responses) than in English (454 [77%, 74-80] of 588 responses). Interpretation The results of our model-evaluation study suggest that GPT-4 is accurate when analysing medical in three different languages. In the future, research should explore how LLMs can be integrated into clinical workflows to maximise their use in health care.					Vigna, Matteo/MBG-3225-2025; Kerivan, Lauren/NBX-4693-2025; Ceriana, Piero/AAB-9668-2020; Malovini, Alberto/I-8727-2018; Sáez, Carlos/AAZ-3935-2020; Kohane, Isaac/K-3716-2012; Buonocore, Tommaso Mario/HKW-7456-2023; Tibollo, Valentina/AAC-1652-2020; Bellazzi, Riccardo/J-6432-2018; Bourgeois, Florence/H-6710-2016; Gutiérrez-Sacristán, Alba/AAL-1427-2020; Patel, Lav/AAZ-4728-2021	Vigna, Matteo/0009-0004-0989-2428; Kerivan, Lauren/0009-0002-7648-2678; Ceriana, Piero/0000-0002-4186-4257; Sáez, Carlos/0000-0003-2678-8249; 														2589-7500				JAN	2025	7	1					e35	e43		10.1016/S2589-7500(24)00246-2	http://dx.doi.org/10.1016/S2589-7500(24)00246-2		DEC 2024						39722251					WOS:001397302500001
J	Hartman, V; Zhang, XY; Poddar, R; Mccarty, M; Fortenko, A; Sholle, E; Sharma, R; Campion, T Jr; Steel, PAD				Hartman, Vince; Zhang, Xinyuan; Poddar, Ritika; Mccarty, Matthew; Fortenko, Alexander; Sholle, Evan; Sharma, Rahul; Campion Jr, Thomas; Steel, Peter A. D.			Developing and Evaluating Large Language Model-Generated Emergency Medicine Handoff Notes	JAMA NETWORK OPEN												ImportanceAn emergency medicine (EM) handoff note generated by a large language model (LLM) has the potential to reduce physician documentation burden without compromising the safety of EM-to-inpatient (IP) handoffs. ObjectiveTo develop LLM-generated EM-to-IP handoff notes and evaluate their accuracy and safety compared with physician-written notes. Design, Setting, and ParticipantsThis cohort study used EM patient medical records with acute hospital admissions that occurred in 2023 at NewYork-Presbyterian/Weill Cornell Medical Center. A customized clinical LLM pipeline was trained, tested, and evaluated to generate templated EM-to-IP handoff notes. Using both conventional automated methods (ie, recall-oriented understudy for gisting evaluation [ROUGE], bidirectional encoder representations from transformers score [BERTScore], and source chunking approach for large-scale inconsistency evaluation [SCALE]) and a novel patient safety-focused framework, LLM-generated handoff notes vs physician-written notes were compared. Data were analyzed from October 2023 to March 2024. ExposureLLM-generated EM handoff notes. Main Outcomes and MeasuresLLM-generated handoff notes were evaluated for (1) lexical similarity with respect to physician-written notes using ROUGE and BERTScore; (2) fidelity with respect to source notes using SCALE; and (3) readability, completeness, curation, correctness, usefulness, and implications for patient safety using a novel framework. ResultsIn this study of 1600 EM patient records (832 [52%] female and mean [SD] age of 59.9 [18.9] years), LLM-generated handoff notes, compared with physician-written ones, had higher ROUGE (0.322 vs 0.088), BERTScore (0.859 vs 0.796), and SCALE scores (0.691 vs 0.456), indicating the LLM-generated summaries exhibited greater similarity and more detail. As reviewed by 3 board-certified EM physicians, a subsample of 50 LLM-generated summaries had a mean (SD) usefulness score of 4.04 (0.86) out of 5 (compared with 4.36 [0.71] for physician-written) and mean (SD) patient safety scores of 4.06 (0.86) out of 5 (compared with 4.50 [0.56] for physician-written). None of the LLM-generated summaries were classified as a critical patient safety risk. Conclusions and RelevanceIn this cohort study of 1600 EM patient medical records, LLM-generated EM-to-IP handoff notes were determined superior compared with physician-written summaries via conventional automated evaluation methods, but marginally inferior in usefulness and safety via a novel evaluation framework. This study suggests the importance of a physician-in-loop implementation design for this model and demonstrates an effective strategy to measure preimplementation patient safety of LLM models.																			2574-3805					DEC 3	2024	7	12							e2448723	10.1001/jamanetworkopen.2024.48723	http://dx.doi.org/10.1001/jamanetworkopen.2024.48723								39625719					WOS:001373803800008
J	Currie, G; Hewis, J; Hawk, E; Rohren, E				Currie, Geoffrey; Hewis, Johnathan; Hawk, Elizabeth; Rohren, Eric			Gender and Ethnicity Bias of Text-to-Image Generative Artificial Intelligence in Medical Imaging, Part 1: Preliminary Evaluation	JOURNAL OF NUCLEAR MEDICINE TECHNOLOGY												Generative artificial intelligence (AI) text-to-image production could reinforce or amplify gender and ethnicity biases. Several text-to-image generative AI tools are used for producing images that represent the medical imaging professions. White male stereotyping and masculine cultures can dissuade women and ethnically divergent people from being drawn into a profession. Methods: In March 2024, DALL-E 3, Firefly 2, Stable Diffusion 2.1, and Midjourney 5.2 were utilized to generate a series of individual and group images of medical imaging professionals: radiologist, nuclear medicine physician, radiographer, and nuclear medicine technologist. Multiple iterations of images were generated using a variety of prompts. Collectively, 184 images were produced for evaluation of 391 characters. All images were independently analyzed by 3 reviewers for apparent gender and skin tone. Results: Collectively (individual and group characters) (n = 391), 60.6% were male and 87.7% were of a light skin tone. DALL-E 3 (65.6%), Midjourney 5.2 (76.7%), and Stable Diffusion 2.1 (56.2%) had a statistically higher representation of men than Firefly 2 (42.9%) (P < 0.0001). With Firefly 2, 70.3% of characters had light skin tones, which was statistically lower (P < 0.0001) than for Stable Diffusion 2.1 (84.8%), Midjourney 5.2 (100%), and DALL-E 3 (94.8%). Overall, image quality metrics were average or better in 87.2% for DALL-E 3 and 86.2% for Midjourney 5.2, whereas 50.9% were inadequate or poor for Firefly 2 and 86.0% for Stable Diffusion 2.1. Conclusion: Generative AI text-to-image generation using DALL-E 3 via GPT-4 has the best overall quality compared with Firefly 2, Midjourney 5.2, and Stable Diffusion 2.1. Nonetheless, DALL-E 3 includes inherent biases associated with gender and ethnicity that demand more critical evaluation.					; Hewis, Johnathan/X-2382-2019	Currie, Geoffrey/0000-0002-6180-8586; Hewis, Johnathan/0000-0002-7810-5641													0091-4916	1535-5675				DEC	2024	52	4					356	359		10.2967/jnmt.124.268332	http://dx.doi.org/10.2967/jnmt.124.268332								39438057					WOS:001460763400016
J	Zhang, KY; Qian, BY; Zhang, XY; Zheng, QH				Zhang, Kaiyuan; Qian, Buyue; Zhang, Xiyuan; Zheng, Qinghua			Using cross-domain knowledge augmentation to explore comorbidity in electronic health records data	EXPERT SYSTEMS WITH APPLICATIONS												Research concentrating on specific diseases or employing single datasets, such as medical histories and thematic data, has garnered considerable attention. However, there has been limited investigation into comorbidities. Although some ad-hoc methods have been utilized in the medical field, there is a scarcity of systematic approaches to address this challenge. The task of expressing patient features using heterogeneous and cross- domain data presents considerable difficulties. Directly mapping this data into a matrix frequently results in issues such as high dimensionality, sparsity, redundancy, and noise. Additionally, given the critical role of supervisory information in medicine, acquiring accurate information is paramount. To address these issues, we propose an enhanced clustering method that capitalizes on cross-domain knowledge augmentation. This method can iteratively learn clustering outcomes and cross-domain knowledge. The cross-domain knowledge matrix produced by our approach can be interpreted as a measure of similarity between instances across domains. We validate our proposed model in real-world electronic health records (EHR) data, and achieve significant performance improvement compared to the baseline method, successfully completing the task of exploring comorbidity. Due to the privacy of EHR data, we also conduct extensive experiments on the publicly available datasets DBLP and UCI. The experimental results show that our algorithm is superior to the baseline algorithm and has strong generality.						, Xiyuan/0009-0004-5468-4150													0957-4174	1873-6793				MAR 5	2025	263								125644	10.1016/j.eswa.2024.125644	http://dx.doi.org/10.1016/j.eswa.2024.125644		NOV 2024											WOS:001358456800001
J	Virgolici, O; Bologa, AR; Costache, RS; Costache, AC; Vîrgolici, B				Virgolici, Oana; Bologa, Ana R.; Costache, Raluca S.; Costache, Andrei C.; Virgolici, Bogdana			Extracting Data from Medical Records for Monitoring Diseases and Generating Medical Alerts	ROMANIAN JOURNAL OF MILITARY MEDICINE												Background: Automated data processing is creating and implementing technology that automatically processes data. This computer tool is recommended for doctors because it supports their everyday work, assists in medical diagnosis, and enhances patient care. The aim of this paper is to propose an informatic tool that can extract the values of some parameters of interest from blood test sheets in order to get medical alerts and to monitor the chronic disease. Methods: An application, written in Python, was developed Results: The computer tool extracted automatically the values of glucose, triglycerides, HDL-cholesterol, total cholesterol, and LDL-cholesterol from medical sheets (text-based file or graphic file, respectively), and saved them in a database, accessed and represented in a graphic form the most recent values of these parameters; alerts according to metabolic syndrome criteria and Framingham risk score were generated. Conclusions: This tool contributes to the management of the medical process, saving precious time and helping the doctor in detecting current or future health problems.					Bologa, Ana Ramona/J-3134-2012; Costache, Raluca/L-9259-2019; Virgolici, Bogdana/MTF-9331-2025														1222-5126	2501-2312				NOV	2024	127	6					448	454		10.55453/rjmm.2024.127.6.4	http://dx.doi.org/10.55453/rjmm.2024.127.6.4													WOS:001394508000004
J	Schwieger, A; Angst, K; de Bardeci, M; Burrer, A; Cathomas, F; Ferrea, S; Grätz, F; Knorr, M; Kronenberg, G; Spiller, T; Troi, D; Seifritz, E; Weber, S; Olbrich, S				Schwieger, Arne; Angst, Katrin; de Bardeci, Mateo; Burrer, Achim; Cathomas, Flurin; Ferrea, Stefano; Gratz, Franziska; Knorr, Marius; Kronenberg, Golo; Spiller, Tobias; Troi, David; Seifritz, Erich; Weber, Samantha; Olbrich, Sebastian			Large language models can support generation of standardized discharge summaries - A retrospective study utilizing ChatGPT-4 and electronic health records	INTERNATIONAL JOURNAL OF MEDICAL INFORMATICS												Objective: To evaluate whether psychiatric discharge summaries (DS) generated with ChatGPT-4 from electronic health records (EHR) can match the quality of DS written by psychiatric residents. Methods: At a psychiatric primary care hospital, we compared 20 inpatient DS, written by residents, to those written with ChatGPT-4 from pseudonymized residents' notes of the patients' EHRs and a standardized prompt. 8 blinded psychiatry specialists rated both versions on a custom Likert scale from 1 to 5 across 15 quality subcategories. The primary outcome was the overall rating difference between the two groups. The secondary outcomes were the rating differences at the level of individual question, case, and rater. Results: Human-written DS were rated significantly higher than AI (mean ratings: human 3.78, AI 3.12, p < 0.05). They surpassed AI significantly in 12/15 questions and 16/20 cases and were favored significantly by 7/8 raters. For "low expected correction effort", human DS were rated as 67 % favorable, 19 % neutral, and 14 % unfavorable, whereas AI-DS were rated as 22 % favorable, 33 % neutral, and 45 % unfavorable. Hallucinations were present in 40 % of AI-DS, with 37.5 % deemed highly clinically relevant. Minor content mistakes were found in 30 % of AI and 10 % of human DS. Raters correctly identified AI-DS with 81 % sensitivity and 75 % specificity. Discussion: Overall, AI-DS did not match the quality of resident-written DS but performed similarly in 20% of cases and were rated as favorable for "low expected correction effort" in 22% of cases. AI-DS lacked most in content specificity, ability to distill key case information, and coherence but performed adequately in conciseness, adherence to formalities, relevance of included content, and form. Conclusion: LLM-written DS show potential as templates for physicians to finalize, potentially saving time in the future.					Burrer, Achim/KIJ-1968-2024; Spiller, Tobias/GRE-8642-2022; Schwieger, Arne/LXB-5452-2024	Burrer, Achim/0000-0003-2012-5655; Cathomas, Flurin/0000-0002-8274-1317; Schwieger, Arne/0009-0002-2398-8456; Weber, Samantha/0000-0002-2689-2938													1386-5056	1872-8243				DEC	2024	192								105654	10.1016/j.ijmedinf.2024.105654	http://dx.doi.org/10.1016/j.ijmedinf.2024.105654		OCT 2024						39437512					WOS:001343302900001
J	Mubarakali, A; Basha, AA				Mubarakali, Azath; Basha, A. Alavudeen			Blockchain technology for secure electronic healthcare record in cloud based cryptographic hash generator	PEER-TO-PEER NETWORKING AND APPLICATIONS												Security and privacy concerns have emerged as significant challenges for enhancing Electronic Health Records (EHR) system for cloud settings. Even though cloud storage offers benefits such as scalability and accessibility, it has risks to the confidentiality and integrity of patients' medical information. Some encryption algorithms are proposed to secure EHR data in cloud, but its efficiency is low. Therefore, the Cryptographic Hash Generator based Blockchain Technology for Secure Electronic Healthcare Record in Cloud (SEHR-BC-CHG) is proposed in this manuscript to maximize the security and secrecy of EHRs. Initially, the data is gathered from the health care centre, which is separated as sensitive and insensitive. To validate transaction authentication, the block chain system employs Cryptographic hash algorithm (CHG) and sensitive medical data is encrypted using the Discrete Shearlet Transform (DST) to enhance security. At Block Chain scheme, the user must submit a request to the CHG for obtaining data from healthcare application. To request verification, the request is distributed from the queue and Hybrid Chaotic Atom Search Optimization Algorithm based tree seed algorithm with Levy flight optimization (HCASOA-TSA-LF) is used to find optimum request that derives via unanimity node to begin the verification procedure. The experimental outcomes shows that the SEHR-BC-CHG method achieves 16.38%, 27.28% and 20.21% lesser encryption time when analyzed with existing models, like Safety enhancement with blockchain based modified infinite chaotic elliptic cryptography in cloud (SEHR-BC-MICEC), Secure clinical data sharing depending on traceable ring signature and blockchain (SEHR-BC-TRSA), a blockchain based privacy aware medical data sharing utilizing smart contract with encryption scheme (SEHR-BC-LFCA) respectively.					Basha, Alavudeen/ABE-8319-2021; MUBARAKALI, AZATH/A-4543-2019														1936-6442	1936-6450				NOV	2024	17	6					4286	4302		10.1007/s12083-024-01789-6	http://dx.doi.org/10.1007/s12083-024-01789-6		OCT 2024											WOS:001330074600001
J	Kim, YH; Kim, C; Kim, YS				Kim, Yu-Hyeon; Kim, Chulho; Kim, Yu-Seop			Language Model-Based Text Augmentation System for Cerebrovascular Disease Related Medical Report	APPLIED SCIENCES-BASEL												Texts in medical fields containing sensitive information pose challenges for AI research usability. However, there is increasing interest in generating synthetic text to make medical text data bigger for text-based medical AI research. Therefore, this paper suggests a text augmentation system for cerebrovascular diseases, using a synthetic text generation model based on DistilGPT2 and a classification model based on BioBERT. The synthetic text generation model generates synthetic text using randomly extracted reports (5000, 10,000, 15,000, and 20,000) from 73,671 reports. The classification model is fine-tuned with the entire report to annotate synthetic text and build a new dataset. Subsequently, we fine-tuned a classification model by incrementally increasing the amount of augmented data added to each original dataset. Experimental results show that fine-tuning by adding augmented data improves model performance by up to 20%. Furthermore, we found that generating a large amount of synthetic text is not necessarily required to achieve better performance, and the appropriate amount of data augmentation depends on the size of the original data. Therefore, our proposed method reduces the time and resources needed for dataset construction, automating the annotation task and generating meaningful synthetic text for medical AI research.					; Kim, Chulho/AAC-8708-2022	Kim, YuHyeon/0009-0002-8621-5637; Kim, Yu-Seop/0000-0003-1645-4173; Kim, Chulho/0000-0001-8762-8340														2076-3417				OCT	2024	14	19							8652	10.3390/app14198652	http://dx.doi.org/10.3390/app14198652													WOS:001332183500001
J	Kumar, N; Goel, V; Ranjan, R; Hassan, MM; Pandey, TK; Dwivedi, A				Kumar, Narendra; Goel, Vikas; Ranjan, Raju; Hassan, Mohamed M.; Pandey, Tushar Kumar; Dwivedi, Akhilesh			A Novel IoT-Blockchain Methodology to Augment Conviction in Electronic Health Records Management	TRAITEMENT DU SIGNAL												There is an absolute necessity for healthcare providers, including hospitals and primary care physicians, to keep patient data secure inside their existing healthcare systems. These systems incorporate electronic health records (EHRs), which store detailed medical histories including diagnoses, treatments, and diagnostic tests as well as demographic information like gender, weight, age, and insurance coverage. Sharing this sensitive medical data securely while avoiding unauthorized access and potential breaches is the biggest challenge. One possible solution to this problem is the use of the cryptographic hashing algorithm SHA256 in conjunction with the IoT. By making it difficult for enemies to understand hashed information, SHA256 strengthens data security. To top it all off, SHA256 works well with verified keys, so you can quickly compare created passwords to existing ones to be sure they're legitimate. Better performance metrics are shown by proposed procedures that use SHA256 compared to existing techniques. The average block creation time, total execution time, and blockchain memory capacity are all significantly lower with these new approaches than with their predecessors, which bodes well for healthcare system efficiency and scalability. Essentially, healthcare systems implementing SHA256 represent a significant step toward improving data security and protecting patient information, leading to aAmore trustworthy healthcare system overall.					Ranjan, Raju/Z-1140-2018; Goel, Vikas/AAQ-6707-2020; Hassan, Mohamed/AFN-0696-2022														0765-0019	1958-5608				OCT	2024	41	5					2279	2286		10.18280/ts.410505	http://dx.doi.org/10.18280/ts.410505													WOS:001359895400005
J	Sukte, CD; Mark, E; Deshmukh, RR				Sukte, Chudaman Devidasrao; Mark, Emmanuel; Deshmukh, Ratnadeep R.			Secured Sharing of Personal Health Records in Cloud with Optimised Signcryption: Improved Shark Smell Optimisation for Key Generation	JOURNAL OF INFORMATION & KNOWLEDGE MANAGEMENT												Recently, personal health records (PHR) have been found to come into view as a patient- centric approach for exchanging health data. With the use of a PHR service, a physician may create, access and maintain all of their personal health information online in one convenient location. Additionally, it has greatly improved the efficient exchange, retrieval and storage of patient data. Each patient is also promised total ownership over their medical records and the option to share their data with a wider range of clients together with friends, family members or healthcare providers. Owing to the higher price of maintaining and building specific data centres, numerous PHR services were contracted out to third-party service providers. Therefore, this work is concerned with carrying out the secured sharing of PHR by inducing the sign-cryption model with an optimisation concept. In the signcryption model, the digital signature encryption is done using an improved AES approach. Further, the key generation is carried out using a self-customised shark smell algorithm (SC-SSA) algorithm. Finally, the evaluation is done to verify the improvement of the system that was used.					; Mark, Emmanuel/E-6243-2019; Sukte, Chudaman/LWK-5743-2024	Deshmukh, Ratnadeep/0000-0002-1257-2300; Mark, Emmanuel/0000-0001-8251-2429; Sukte, Chudaman/0000-0002-2100-8242; 													0219-6492	1793-6926				FEB	2025	24	01								10.1142/S0219649224500977	http://dx.doi.org/10.1142/S0219649224500977		OCT 2024											WOS:001326610100001
