PT	AU	BA	BE	GP	AF	BF	CA	TI	SO	SE	BS	LA	DT	CT	CY	CL	SP	HO	DE	ID	AB	C1	C3	RP	EM	RI	OI	FU	FP	FX	CR	NR	TC	Z9	U1	U2	PU	PI	PA	SN	EI	BN	J9	JI	PD	PY	VL	IS	PN	SU	SI	MA	BP	EP	AR	DI	DL	D2	EA	PG	WC	WE	SC	GA	PM	OA	HC	HP	DA	UT
J	Venugopal, R; Shafqat, N; Venugopal, I; Tillbury, BMJ; Stafford, HD; Bourazeri, A				Venugopal, Rohit; Shafqat, Noman; Venugopal, Ishwar; Tillbury, Benjamin Mark John; Stafford, Harry Demetrios; Bourazeri, Aikaterini			Privacy preserving Generative Adversarial Networks to model Electronic Health Records	NEURAL NETWORKS												Hospitals and General Practitioner (GP) surgeries within National Health Services (NHS), collect patient information on a routine basis to create personal health records such as family medical history, chronic diseases, medications and dosing. The collected information could be used to build and model various machine learning algorithms, to simplify the task of those working within the NHS. However, such Electronic Health Records are not made publicly available due to privacy concerns. In our paper, we propose a privacy-preserving Generative Adversarial Network (pGAN), which can generate synthetic data of high quality, while preserving the privacy and statistical properties of the source data. pGAN is evaluated on two distinct datasets, one posing as a Classification task, and the other as a Regression task. Privacy score of generated data is calculated using the Nearest Neighbour Adversarial Accuracy. Cosine similarity scores of synthetic data from our proposed model indicate that the data generated is similar in nature, but not identical. Additionally, our proposed model was able to preserve privacy while maintaining high utility. Machine learning models trained on both synthetic data and original data have achieved accuracies of 74.3% and 74.5% respectively on the classification dataset; while they have attained an R2-Score of 0.84 and 0.85 on synthetic and original data of the regression task respectively. Our results, therefore, indicate that synthetic data from the proposed model could replace the use of original data for machine learning while preserving privacy. (C) 2022 The Author(s). Published by Elsevier Ltd.					; Bourazeri, Aikaterini/KYR-0494-2024	Venugopal, Rohit/0000-0003-0105-2032; 													0893-6080	1879-2782				SEP	2022	153						339	348		10.1016/j.neunet.2022.06.022	http://dx.doi.org/10.1016/j.neunet.2022.06.022		JUN 2022						35779443					WOS:000823104800016
J	Holt, JM; Spanbauer, C; Cusatis, R; Winn, AN; Talsma, A; Asan, O; Somai, M; Hanson, R; Moore, J; Makoul, G; Crotty, BH				Holt, Jeana M.; Spanbauer, Charles; Cusatis, Rachel; Winn, Aaron N.; Talsma, AkkeNeel; Asan, Onur; Somai, Melek; Hanson, Ryan; Moore, Jennifer; Makoul, Gregory; Crotty, Bradley H.			Real-world implementation evaluation of an electronic health record-integrated consumer informatics tool that collects patient-generated contextual data	INTERNATIONAL JOURNAL OF MEDICAL INFORMATICS												Objective: Use the RE-AIM framework to examine the implementation of a patient contextual data (PCD) Tool designed to share patients' needs, values, and preferences with care teams ahead of clinical encounters.Materials & Methods: Observational study that follows initial PCD Tool scaling across primary care at a Midwestern academic health network. Program invitations, enrollment, patient submissions, and clinician views were tracked over a 1-year study period. Logistic regression modeled the likelihood of using the PCD Tool, accounting for patient covariates.Results: Of 58,874 patients who could be contacted by email, 9,183 (15.6%) became PCD Tool users. Overall, 76% of primary care providers had patients who used the PCD Tool. Older age, female gender, non-minority race, patient portal activation, and Medicare coverage were significantly associated with increased likelihood of use. Number of office visits, medical issues, and behavioral health conditions also associated with use. Primary care staff viewed 18.7% of available PCD Tool summaries, 1.1% to 57.6% per clinic. Discussion: The intervention mainly reached non-minority patients and patients who used more health services. Given the requirement for an email address on file, some patients may have been underrepresented. Overall, patient reach and adoption and clinician adoption, implementation, and maintenance of this Tool were modest but stable, consistent with a non-directive approach to fostering adoption by introducing the Tool in the absence of clear expectations for use.Conclusion: Healthcare organizations must implement effective methods to increase the reach, adoption, implementation, and maintenance of PCD tools across all patient populations. Assisting people, particularly racial minorities, with PCD Tool registration and actively supporting clinician use are critical steps in implementing technology that facilitates care.					Crotty, Bradley/E-6332-2015; Spanbauer, Charles/AAZ-2193-2021	Winn, Aaron/0000-0003-2906-3913; Holt, Jeana/0000-0003-3392-0164; 													1386-5056	1872-8243				SEP	2022	165								104810	10.1016/j.ijmedinf.2022.104810	http://dx.doi.org/10.1016/j.ijmedinf.2022.104810		JUN 2022						35714549					WOS:000822953600003
J	Dramburg, S; Perna, S; Di Fraia, M; Tripodi, S; Arasi, S; Castelli, S; Villalta, D; Buzzulini, F; Sfika, I; Villella, V; Potapova, E; Brighetti, MA; Travaglini, A; Verardo, P; Pelosi, S; Matricardi, PM				Dramburg, Stephanie; Perna, Serena; Di Fraia, Marco; Tripodi, Salvatore; Arasi, Stefania; Castelli, Sveva; Villalta, Danilo; Buzzulini, Francesca; Sfika, Ifigenia; Villella, Valeria; Potapova, Ekaterina; Brighetti, Maria Antonia; Travaglini, Alessandro; Verardo, Pierluigi; Pelosi, Simone; Matricardi, Paolo Maria			Validation Parameters of Patient-Generated Data for Digitally Recorded Allergic Rhinitis Symptom and Medication Scores in the @IT.2020 Project: Exploratory Study	JMIR MHEALTH AND UHEALTH												Background: Mobile health technologies enable allergists to monitor disease trends by collecting daily patient-reported outcomes of allergic rhinitis. To this end, patients with allergies are usually required to enter their symptoms and medication repetitively over long time periods, which may present a risk to data completeness and quality in the case of insufficient effort reporting. Completeness of patient's recording is easily measured. In contrast, the intrinsic quality and accuracy of the data entered by the patients are more elusive. Objective: The aim of this study was to explore the association of adherence to digital symptom recording with a predefined set of parameters of the patient-generated symptom and medication scores and to identify parameters that may serve as proxy measure of the quality and reliability of the information recorded by the patient. Methods: The @IT.2020 project investigates the diagnostic synergy of mobile health and molecular allergology in patients with seasonal allergic rhinitis. In its pilot phase, 101 children with seasonal allergic rhinitis were recruited in Rome and instructed to record their symptoms, medication intake, and general conditions daily via a mobile app (AllergyMonitor) during the relevant pollen season. We measured adherence to daily recording as the percentage of days with data recording in the observation period. We examined the patient's trajectories of 3 disease indices (Rhinoconjunctivitis Total Symptom Score [RTSS], Combined Symptom and Medication Score [CSMS], and Visual Analogue Scale [VAS]) as putative proxies of data quality with the following 4 parameters: (1) intravariation index, (2) percentage of zero values, (3) coefficient of variation, and (4) percentage of changes in trend. Lastly, we examined the relationship between adherence to recording and each of the 4 proxy measures. Results: Adherence to recording ranged from 20% (11/56) to 100% (56/56), with 64.4% (65/101) and 35.6% (36/101) of the patients' values above (highly adherent patients) or below (low adherent patients) the threshold of 80%, respectively. The percentage of zero values, the coefficient of variation, and the intravariation index did not significantly change with the adherence to recording. By contrast, the proportion of changes in trend was significantly higher among highly adherent patients, independently from the analyzed score (RTSS, CSMS, and VAS). Conclusions: The percentage of changes in the trend of RTSS, CSMS, and VAS is a valuable candidate to validate the quality and accuracy of the data recorded by patients with allergic rhinitis during the pollen season. The performance of this parameter must be further investigated in real-life conditions before it can be recommended for routine use in apps and electronic diaries devoted to the management of patients with allergic rhinitis.					; Dramburg, Stephanie/AAM-8340-2020; Arasi, Stefania/K-2858-2018	Castelli, Sveva/0000-0001-7660-5354; Tripodi, Salvatore/0000-0003-2517-3285; Potapova, Ekaterina/0000-0003-4427-6335; amburg, Stephanie/0000-0002-9303-3260; Di Fraia, Marco/0000-0002-9679-8859													2291-5222					JUN	2022	10	6							e31491	10.2196/31491	http://dx.doi.org/10.2196/31491								35657659					WOS:000834634400002
J	You, S; Park, MS; Joo, S				You, Sukjin; Park, Min Sook; Joo, Soohyung			Practicability of Ensemble Artificial Neural Network Models for a Classification Task: An Optimal Approach for Reproducing Classification Practices of Health Consumers Generated Text on Social Media	JOURNAL OF LIBRARY AND INFORMATION STUDIES												This paper reports the classification accuracy of artificial neural network (ANN) models in reproducing health consumers' classification practices in social media. Social media have driven the growth of unstructured text data across domains including health, which motivates researchers to reconsider the epistemological approach to automated classification. This study compared the performance of several types of ANN models and ensemble models based on classification results and the integration of multiple ANN structures. To train these models, two dictionaries were employed: health consumers' terms extracted from questions and answers in the health categories of Yahoo!Answers and MeSH terms. All three types of individual classifiers demonstrated accuracies of around 90%. In particular, the fully connected ANN with two layers produced relatively higher classification performances than a convolutional neural network and long short-term memory. Ensemble models based on classification results outperformed not only the ensemble models based on the integration of heterogeneous ANN structures but also individual deep-learning models. The combination of questions and best answers were found to be most effective as a training dataset to build an accurate prediction model. The findings suggest that ANN models can be an effective assistive tool in classifying online health resources generated by health consumers in natural language					; You, Sukjin/HOC-9918-2023	Park, Min Sook/0000-0002-1870-3324; 													1606-7509	2309-9119				JUN	2022	20	1					1	30		10.6182/jlis.202206_20(1).001	http://dx.doi.org/10.6182/jlis.202206_20(1).001													WOS:000822400500001
J	Kinouchi, K; Ohashi, K				Kinouchi, Kaori; Ohashi, Kazutomo			Assessing Engagement With Patient-Generated Health Data Recording and Its Impact on Health Behavior Changes in Multicomponent Interventions: Supplementary Analysis	JMIR FORMATIVE RESEARCH												Background: The use and sharing of patient-generated health data (PGHD) by clinicians or researchers is expected to enhance the remote monitoring of specific behaviors that affect patient health. In addition, PGHD use could support patients'decision-making on preventive care management, resulting in reduced medical expenses. However, sufficient evidence on the use and sharing of PGHD is lacking, and the impact of PGHD recording on patients' health behavior changes remains unclear. Objective: This study aimed to assess patients'engagement with PGHD recording and to examine the impact of PGHD recording on their health behavior changes. Methods: This supplementary analysis used the data of 47 postpartum women who had been assigned to the intervention group of our previous study for managing urinary incontinence. To assess the patients' engagement with PGHD recording during the intervention period (8 weeks), the fluctuation in the number of patients who record their PGHD (ie, PGHD recorders) was evaluated by an approximate curve. In addition, to assess adherence to the pelvic floor muscle training (PFMT), the weekly mean number of pelvic floor muscle contractions performed per day among 17 PGHD recorders was examined by latent class growth modeling (LCGM). Results: The fluctuation in the number of PGHD recorders was evaluated using the sigmoid curve formula (R2=0.91). During the first week of the intervention, the percentage of PGHD recorders was around 64% (30/47) and then decreased rapidly from the second to the third week. After the fourth week, the percentage of PGHD recorders was 36% (17/47), which remained constant until the end of the intervention. When analyzing the data of these 17 PGHD recorders, PFMT adherence was categorized into 3 classes by LCGM: high (7/17, 41%), moderate (3/17, 18%), and low (7/17, 41%). Conclusions: The number of PGHD recorders declined over time in a sigmoid curve. A small number of users recorded PGHD continuously; therefore, patients' engagement with PGHD recording was low. In addition, more than half of the PGHD recorders (moderate- and low-level classes combined: 10/17, 59%) had poor PFMT adherence. These results suggest that PGHD recording does not always promote health behavior changes.																				2561-326X				MAY	2022	6	5							e35471	10.2196/35471	http://dx.doi.org/10.2196/35471								35503411					WOS:000854077500007
J	Guan, Q; Chen, YZ; Wei, ZH; Heidari, AA; Hu, HG; Yang, XH; Zheng, JW; Zhou, QW; Chen, HL; Chen, F				Guan, Qiu; Chen, Yizhou; Wei, Zihan; Heidari, Ali Asghar; Hu, Haigen; Yang, Xu-Hua; Zheng, Jianwei; Zhou, Qianwei; Chen, Huiling; Chen, Feng			Medical image augmentation for lesion detection using a texture-constrained multichannel progressive GAN	COMPUTERS IN BIOLOGY AND MEDICINE												Lesion detectors based on deep learning can assist doctors in diagnosing diseases. However, the performance of current detectors is likely to be unsatisfactory due to the scarcity of training samples. Therefore, it is beneficial to use image generation to augment the training set of a detector. However, when the imaging texture of the medical image is relatively delicate, the synthesized image generated by an existing method may be too poor in quality to meet the training requirements of the detectors. In this regard, a medical image augmentation method, namely, a texture-constrained multichannel progressive generative adversarial network (TMP-GAN), is proposed in this work. TMP-GAN uses joint training of multiple channels to effectively avoid the typical shortcomings of the current generation methods. It also uses an adversarial learning-based texture discrimination loss to further improve the fidelity of the synthesized images. In addition, TMP-GAN employs a progressive generation mechanism to steadily improve the accuracy of the medical image synthesizer. Experiments on the publicly available dataset CBIS-DDMS and our pancreatic tumor dataset show that the precision/recall/F1-score of the detector trained on the TMP-GAN augmented dataset improves by 2.59%/2.70%/2.77% and 2.44%/2.06%/ 2.36%, respectively, compared to the optimal results of other data augmentation methods. The FROC curve of the detector is also better than the curve from the contrast-augmented trained dataset. Therefore, we believe the proposed TMP-GAN is a practical technique to efficiently implement lesion detection case studies.					Heidari, Ali Asghar/M-6255-2018; Zheng, Jianwei/OUJ-3110-2025; Zhou, Qianwei/B-5636-2019; Guan, Qiu/G-7683-2012; Hu, Haigen/J-1009-2019; Chen, Huiling/N-8510-2019; wei, zihan/KWU-2135-2024	Heidari, Ali Asghar/0000-0001-6938-9948; Chen, Yizhou/0000-0003-1412-3151; Guan, Qiu/0000-0002-6928-3040; 													0010-4825	1879-0534				JUN	2022	145								105444	10.1016/j.compbiomed.2022.105444	http://dx.doi.org/10.1016/j.compbiomed.2022.105444		APR 2022						35421795					WOS:000805972600003
J	Hanson, G; Chitnis, T; Williams, MJ; Gan, RW; Julian, L; Mace, K; Chia, J; Wormser, D; Martinec, M; Astorino, T; Leviner, N; Maung, P; Jan, A; Belendiuk, K				Hanson, Gillian; Chitnis, Tanuja; Williams, Mitzi J.; Gan, Ryan William; Julian, Laura; Mace, Kieran; Chia, Jenny; Wormser, David; Martinec, Michael; Astorino, Troy; Leviner, Noga; Maung, Pye; Jan, Asif; Belendiuk, Katherine			Generating real-world data from health records: design of a patient-centric study in multiple sclerosis using a commercial health records platform	JAMIA OPEN												Objective The FlywheelMS study will explore the use of a real-world health record data set generated by PicnicHealth, a patient-centric health records platform, to improve understanding of disease course and patterns of care for patients with multiple sclerosis (MS). Materials and Methods The FlywheelMS study aims to enroll 5000 adults with MS in the United States to create a large, deidentified, longitudinal data set for clinical research. PicnicHealth obtains health records, including paper charts, electronic health records, and radiology imaging files from any healthcare site. Using a large-scale health record processing pipeline, PicnicHealth abstracts standard and condition-specific data elements from structured (eg, laboratory test results) and unstructured (eg, narrative) text and maps these to standardized medical vocabularies. Researchers can use the resulting data set to answer empirical questions and study participants can access and share their harmonized health records using PicnicHealth's web application. Results As of November 24, 2020, more than 4176 participants from 49 of 50 US states have enrolled in the FlywheelMS study. A median of 200 pages of records have been collected from 14 different doctors over 8 years per participant. Abstraction precision, established through inter-abstractor agreement, is as high as 97.8% when identifying and mapping data elements to a standard ontology. Conclusion Using a commercial health records platform, the FlywheelMS study is generating a real-world, multimodal data set that could provide valuable insights about patients with MS. This approach to data collection and abstraction is disease-agnostic and could be used to address other clinical research questions in the future. Lay Summary Health records contain valuable information about patients and the care they receive in routine clinical practice; however, use of this data source in research is hindered by the difficulty of obtaining complete analyzable data sets. In the United States, health records for each patient are stored in paper and electronic formats across multiple healthcare providers. Furthermore, data must be extracted from health records before they can be analyzed, which is technically difficult for images and free text. In the first part of this paper, we describe how PicnicHealth, a commercial health records platform, collects health records on behalf of patients in any format and from all healthcare sites. Facilitated by tailored software tools and task-specific machine-learning models, data are extracted from health records by human experts in an efficient and precise manner. This enables patients to access and manage their health record data via a web application. The second part of this paper describes the design, rationale, and recruitment metrics for the ongoing FlywheelMS study, which is exploring whether an anonymized data set generated by PicnicHealth can improve our understanding of the disease course and patterns of care for patients with multiple sclerosis.					; Chitnis, Tanuja/LZF-7287-2025	Willia, Mitzi Joi/0000-0001-6979-1101; 														2574-2531				JAN 7	2022	5	1							ooab110	10.1093/jamiaopen/ooab110	http://dx.doi.org/10.1093/jamiaopen/ooab110								35155999					WOS:000764262900006
J	Al Aziz, MM; Ahmed, T; Faequa, T; Jiang, XQ; Yao, YY; Mohammed, N				Al Aziz, Md Momin; Ahmed, Tanbir; Faequa, Tasnia; Jiang, Xiaoqian; Yao, Yi yu; Mohammed, Noman			Differentially Private Medical Texts Generation Using Generative Neural Networks	ACM TRANSACTIONS ON COMPUTING FOR HEALTHCARE												Technological advancements in data science have offered us affordable storage and efficient algorithms to query a large volume of data. Our health records are a significant part of this data, which is pivotal for healthcare providers and can be utilized in our well-being. The clinical note in electronic health records is one such category that collects a patient's complete medical information during different timesteps of patient care available in the form of free-texts. Thus, these unstructured textual notes contain events from a patient's admission to discharge, which can prove to be significant for future medical decisions. However, since these texts also contain sensitive information about the patient and the attending medical professionals, such notes cannot be shared publicly. This privacy issue has thwarted timely discoveries on this plethora of untapped information. Therefore, in this work, we intend to generate synthetic medical texts from a private or sanitized (de-identified) clinical text corpus and analyze their utility rigorously in different metrics and levels. Experimental results promote the applicability of our generated data as it achieves more than 80% accuracy in different pragmatic classification problems and matches (or outperforms) the original text data.					Jiang, Xiaoqian/K-6752-2012	Jiang, Xiaoqian/0000-0001-9933-2205													2691-1957	2637-8051				JAN	2022	3	1							5	10.1145/3469035	http://dx.doi.org/10.1145/3469035													WOS:001415818700008
J	Kawar, LN; Crawford, CL; Mendoza, RG; Harrison, SJ; Thibodeaux, MW; Spicer, JE				Kawar, Lina Najib; Crawford, Cecelia L.; Mendoza, Rosalina G.; Harrison, Staci J.; Thibodeaux, Mariaelena Washington; Spicer, Jerry E.			Validity and Usefulness of an Electronic Health Care Record-Generated Mobility Ambulation Tool The Human Body Was Designed to Move	JOURNAL OF NURSING CARE QUALITY												Background: Mobility is a vital function of human life. Nurses have an essential role in preventing hospitalized patient complications through movement and ambulation. Purpose: This study examined the integration, accuracy, and precision of a paper-based mobility/ambulation tool into an electronic health record (EHR) to assess inpatient mobility/ambulation status. Methods: This multisite mixed-methods study was a time-series correlational evaluation of a mobility/ambulation tool into the EHR. Results: Sustainability data revealed strong correlations between nurse responses and EHR levels (r = 0.602; scores r = 0.624). Cronbach's alpha values were 0.737 and 0.761. Nurses' anecdotes supported the findings. Conclusion: Findings revealed that the EHR-Mobility Ambulation Tool is a valid, reliable, and stable tool. EHR-generated scores can assist in reducing charting burden, care planning, and inform the interdisciplinary health team at all patient care stages. Tool adoption could potentially assist nurses plan interventions suitable to maintain or increase hospitalized patients' mobility status and contribute to discharge planning.					Crawford, Cecelia/AAF-4410-2021	Mendoza, Rosalina/0009-0000-3422-3665													1057-3631	1550-5065				JAN-MAR	2022	37	1					68	74		10.1097/NCQ.0000000000000580	http://dx.doi.org/10.1097/NCQ.0000000000000580								34261088					WOS:000721028600016
J	Kim, DH; Lee, Y; Oh, JS; Seo, DW; Lee, KH; Kim, YH; Kim, WS; Lee, JH				Kim, Do-Hoon; Lee, Yura; Oh, Ji Seon; Seo, Dong-Woo; Lee, Kye Hwa; Kim, Young-Hak; Kim, Woo Sung; Lee, Jae-Ho			Effects of Patient-Generated Health Data: Comparison of Two Versions of Long-Term Mobile Personal Health Record Usage Logs	HEALTHCARE												Patient-generated health data (PGHD) can be managed easily by a mobile personal health record (mPHR) and can increase patient engagement. This study investigated the effect of PGHD functions on mPHR usage. We collected usage log data from an mPHR app, My Chart in My Hand (MCMH), for seven years. We analyzed the number of accesses and trends for each menu by age and sex according to the version-up. Generalized estimating equation (GEE) analysis was used to determine the likelihood of continuous app usage according to the menus and version-up. The total number of users of each version were 15,357 and 51,553, respectively. Adult females under 50 years were the most prevalent user group (30.0%). The "My Chart" menu was the most accessed menu, and the total access count increased by similar to 10 times after the version-up. The "Health Management" menu designed for PGHD showed the largest degree of increase in its likelihood of continuous usage after the version-up (1.245; p < 0.0001) across menus (range: 0.925-1.050). Notably, improvement of PGHD management in adult females over 50 years is needed.						Lee, Kye Hwa/0000-0002-7593-7020; Kim, Do-Hoon/0000-0003-3703-9796														2227-9032				JAN	2022	10	1							53	10.3390/healthcare10010053	http://dx.doi.org/10.3390/healthcare10010053								35052217					WOS:000975907400001
