PT	AU	BA	BE	GP	AF	BF	CA	TI	SO	SE	BS	LA	DT	CT	CY	CL	SP	HO	DE	ID	AB	C1	C3	RP	EM	RI	OI	FU	FP	FX	CR	NR	TC	Z9	U1	U2	PU	PI	PA	SN	EI	BN	J9	JI	PD	PY	VL	IS	PN	SU	SI	MA	BP	EP	AR	DI	DL	D2	EA	PG	WC	WE	SC	GA	PM	OA	HC	HP	DA	UT
J	Strasser, ZH; Dagliati, A; Abad, ZSH; Klann, JG; Wagholikar, KB; Mesa, R; Visweswaran, S; Morris, M; Luo, Y; Henderson, DW; Consortium Clin Characterization COVID EHR CE; Omenn, GS; Xia, ZQ; Holmes, JH; Estiri, H; Murphy, SN				Strasser, Zachary H.; Dagliati, Arianna; Abad, Zahra Shakeri Hossein; Klann, Jeffrey G.; Wagholikar, Kavishwar B.; Mesa, Rebecca; Visweswaran, Shyam; Morris, Michele; Luo, Yuan; Henderson, Darren W.; Consortium Clin Characterization COVID EHR CE, Gilbert S.; Omenn, Gilbert S.; Xia, Zongqi; Holmes, John H.; Estiri, Hossein; Murphy, Shawn N.		Samayamuthu, MJ	A retrospective cohort analysis leveraging augmented intelligence to characterize long COVID in the electronic health record: A precision medicine framework	PLOS DIGITAL HEALTH												Physical and psychological symptoms lasting months following an acute COVID-19 infection are now recognized as post-acute sequelae of COVID-19 (PASC). Accurate tools for identifying such patients could enhance screening capabilities for the recruitment for clinical trials, improve the reliability of disease estimates, and allow for more accurate downstream cohort analysis. In this retrospective cohort study, we analyzed the EHR of hospitalized COVID-19 patients across three healthcare systems to develop a pipeline for better identifying patients with persistent PASC symptoms (dyspnea, fatigue, or joint pain) after their SARS-CoV-2 infection. We implemented distributed representation learning powered by the Machine Learning for modeling Health Outcomes (MLHO) to identify novel EHR features that could suggest PASC symptoms outside of typical diagnosis codes. MLHO applies an entropy-based feature selection and boosting algorithms for representation mining. These improved definitions were then used for estimating PASC among hospitalized patients. 30,422 hospitalized patients were diagnosed with COVID-19 across three healthcare systems between March 13, 2020 and February 28, 2021. The mean age of the population was 62.3 years (SD, 21.0 years) and 15,124 (49.7%) were female. We implemented the distributed representation learning technique to augment PASC definitions. These definitions were found to have positive predictive values of 0.73, 0.74, and 0.91 for dyspnea, fatigue, and joint pain, respectively. We estimated that 25 percent (CI 95%: 6-48), 11 percent (CI 95%: 6-15), and 13 percent (CI 95%: 8-17) of hospitalized COVID-19 patients will have dyspnea, fatigue, and joint pain, respectively, 3 months or longer after a COVID-19 diagnosis. We present a validated framework for screening and identifying patients with PASC in the EHR and then use the tool to estimate its prevalence among hospitalized COVID-19 patients.					; Wagholikar, Kavishwar/M-1249-2013; Dagliati, Arianna/I-7119-2019	Henderson, Darren/0000-0001-6198-1912; Strasser, Zachary/0000-0002-4846-6059; 														2767-3170				JUL	2023	2	7							e0000301	10.1371/journal.pdig.0000301	http://dx.doi.org/10.1371/journal.pdig.0000301								37490472					WOS:001416647800001
J	Park, J; Artin, MG; Lee, KE; May, BL; Park, M; Hur, C; Tatonetti, NP				Park, Jiheum; Artin, Michael G.; Lee, Kate E.; May, Benjamin L.; Park, Michael; Hur, Chin; Tatonetti, Nicholas P.			Structured deep embedding model to generate composite clinical indices from electronic health records for early detection of pancreatic cancer	PATTERNS												The high-dimensionality, complexity, and irregularity of electronic health records (EHR) data create significant challenges for both simplified and comprehensive health assessments, prohibiting an efficient extraction of actionable insights by clinicians. If we can provide human decision-makers with a simplified set of interpretable composite indices (i.e., combining information about groups of related measures into single representative values), it will facilitate effective clinical decision-making. In this study, we built a structured deep embedding model aimed at reducing the dimensionality of the input variables by grouping related measurements as deter-mined by domain experts (e.g., clinicians). Our results suggest that composite indices representing liver func-tion may consistently be the most important factor in the early detection of pancreatic cancer (PC). We propose our model as a basis for leveraging deep learning toward developing composite indices from EHR for predict-ing health outcomes, including but not limited to various cancers, with clinically meaningful interpretations.						Artin, Michael/0000-0002-9872-305X													2666-3899					JAN 13	2023	4	1							100636	10.1016/j.patter.2022.100636	http://dx.doi.org/10.1016/j.patter.2022.100636		JAN 2023						36699740					WOS:000919834400001
J	Li, RZ; Tian, Y; Shen, ZY; Li, J; Li, J; Ding, KF; Li, JS				Li, Runze; Tian, Yu; Shen, Zhuyi; Li, Jin; Li, Jun; Ding, Kefeng; Li, Jingsong			Improving an Electronic Health Record-Based Clinical Prediction Model Under Label Deficiency: Network-Based Generative Adversarial Semisupervised Approach	JMIR MEDICAL INFORMATICS												Background: Observational biomedical studies facilitate a new strategy for large-scale electronic health record (EHR) utilization to support precision medicine. However, data label inaccessibility is an increasingly important issue in clinical prediction, despite the use of synthetic and semisupervised learning from data. Little research has aimed to uncover the underlying graphical structure of EHRs. Objective: A network-based generative adversarial semisupervised method is proposed. The objective is to train clinical prediction models on label-deficient EHRs to achieve comparable learning performance to supervised methods. Methods: Three public data sets and one colorectal cancer data set gathered from the Second Affiliated Hospital of Zhejiang University were selected as benchmarks. The proposed models were trained on 5% to 25% labeled data and evaluated on classification metrics against conventional semisupervised and supervised methods. The data quality, model security, and memory scalability were also evaluated. Results: The proposed method for semisupervised classification outperforms related semisupervised methods under the same setup, with the average area under the receiver operating characteristics curve (AUC) reaching 0.945, 0.673, 0.611, and 0.588 for the four data sets, respectively, followed by graph-based semisupervised learning (0.450, 0.454, 0.425, and 0.5676, respectively) and label propagation (0.475,0.344, 0.440, and 0.477, respectively). The average classification AUCs with 10% labeled data were 0.929, 0.719, 0.652, and 0.650, respectively, comparable to that of the supervised learning methods logistic regression (0.601, 0.670, 0.731, and 0.710, respectively), support vector machines (0.733, 0.720, 0.720, and 0.721, respectively), and random forests (0.982, 0.750, 0.758, and 0.740, respectively). The concerns regarding the secondary use of data and data security are alleviated by realistic data synthesis and robust privacy preservation.Conclusions: Training clinical prediction models on label-deficient EHRs is indispensable in data-driven research. The proposed method has great potential to exploit the intrinsic structure of EHRs and achieve comparable learning performance to supervised methods.					; Tian, Yu/PBV-6198-2025	Shen, Zhuyi/0000-0002-6333-3633; Li, Jingsong/0000-0002-1064-637X; Li, Runze/0009-0004-9380-3407; Li, Jin/0009-0006-2316-9169														2291-9694					2023	11								e47862	10.2196/47862	http://dx.doi.org/10.2196/47862								37310778					WOS:001017551900001
J	Sezgin, E; Hussain, SA; Rust, S; Huang, YG				Sezgin, Emre; Hussain, Syed-Amad; Rust, Steve; Huang, Yungui			Extracting Medical Information From Free-Text and Unstructured Patient-Generated Health Data Using Natural Language Processing Methods: Feasibility Study With Real-world Data	JMIR FORMATIVE RESEARCH												Background: Patient-generated health data (PGHD) captured via smart devices or digital health technologies can reflect an individual health journey. PGHD enables tracking and monitoring of personal health conditions, symptoms, and medications out of the clinic, which is crucial for self-care and shared clinical decisions. In addition to self-reported measures and structured PGHD (eg, self-screening, sensor-based biometric data), free-text and unstructured PGHD (eg, patient care note, medical diary) can provide a broader view of a patient's journey and health condition. Natural language processing (NLP) is used to process and analyze unstructured data to create meaningful summaries and insights, showing promise to improve the utilization of PGHD.Objective: Our aim is to understand and demonstrate the feasibility of an NLP pipeline to extract medication and symptom information from real-world patient and caregiver data.Methods: We report a secondary data analysis, using a data set collected from 24 parents of children with special health care needs (CSHCN) who were recruited via a nonrandom sampling approach. Participants used a voice-interactive app for 2 weeks, generating free-text patient notes (audio transcription or text entry). We built an NLP pipeline using a zero-shot approach (adaptive to low-resource settings). We used named entity recognition (NER) and medical ontologies (RXNorm and SNOMED CT [Systematized Nomenclature of Medicine Clinical Terms]) to identify medication and symptoms. Sentence-level dependency parse trees and part-of-speech tags were used to extract additional entity information using the syntactic properties of a note. We assessed the data; evaluated the pipeline with the patient notes; and reported the precision, recall, and F1 scores.Results: In total, 87 patient notes are included (audio transcriptions n=78 and text entries n=9) from 24 parents who have at least one CSHCN. The participants were between the ages of 26 and 59 years. The majority were White (n=22, 92%), had more than one child (n=16, 67%), lived in Ohio (n=22, 92%), had mid-or upper-mid household income (n=15, 62.5%), and had higher level education (n=24, 58%). Out of 87 notes, 30 were drug and medication related, and 46 were symptom related. We captured medication instances (medication, unit, quantity, and date) and symptoms satisfactorily (precision >0.65, recall >0.77, F1>0.72). These results indicate the potential when using NER and dependency parsing through an NLP pipeline on information extraction from unstructured PGHD.Conclusions: The proposed NLP pipeline was found to be feasible for use with real-world unstructured PGHD to accomplish medication and symptom extraction. Unstructured PGHD can be leveraged to inform clinical decision-making, remote monitoring, and self-care including medical adherence and chronic disease management. With customizable information extraction methods using NER and medical ontologies, NLP models can feasibly extract a broad range of clinical information from unstructured PGHD in low-resource settings (eg, a limited number of patient notes or training data).(JMIR Form Res 2023;7:e43014) doi: 10.2196/43014					; Sezgin, Emre/I-7969-2019	Huang, Yungui/0000-0003-3265-9902; Sezgin, Emre/0000-0001-8798-9605; Hussain, Syed-Amad/0000-0002-7529-8644														2561-326X					2023	7									10.2196/43014	http://dx.doi.org/10.2196/43014								36881467					WOS:001000224400013
J	Chen, AJ; Huang, R; Wu, ER; Han, RB; Wen, J; Li, QH; Zhang, ZY; Shen, BR				Chen, Anjun; Huang, Ran; Wu, Erman; Han, Ruobing; Wen, Jian; Li, Qinghua; Zhang, Zhiyong; Shen, Bairong			The Generation of a Lung Cancer Health Factor Distribution Using Patient Graphs Constructed From Electronic Medical Records: Retrospective Study	JOURNAL OF MEDICAL INTERNET RESEARCH												Background: Electronic medical records (EMRs) of patients with lung cancer (LC) capture a variety of health factors. Understanding the distribution of these factors will help identify key factors for risk prediction in preventive screening for LC. Objective: We aimed to generate an integrated biomedical graph from EMR data and Unified Medical Language System (UMLS) ontology for LC, and to generate an LC health factor distribution from a hospital EMR of approximately 1 million patients. Methods: The data were collected from 2 sets of 1397 patients with and those without LC. A patient-centered health factor graph was plotted with 108,000 standardized data, and a graph database was generated to integrate the graphs of patient health factors and the UMLS ontology. With the patient graph, we calculated the connection delta ratio (CDR) for each of the health factors to measure the relative strength of the factor's relationship to LC. Results: The patient graph had 93,000 relations between the 2794 patient nodes and 650 factor nodes. An LC graph with 187 related biomedical concepts and 188 horizontal biomedical relations was plotted and linked to the patient graph. Searching the integrated biomedical graph with any number or category of health factors resulted in graphical representations of relationships between patients and factors, while searches using any patient presented the patient's health factors from the EMR and the LC knowledge graph (KG) from the UMLS in the same graph. Sorting the health factors by CDR in descending order generated a distribution of health factors for LC. The top 70 CDR-ranked factors of disease, symptom, medical history, observation, and laboratory test categories were verified to be concordant with those found in the literature. Conclusions: By collecting standardized data of thousands of patients with and those without LC from the EMR, it was possible to generate a hospital-wide patient-centered health factor graph for graph search and presentation. The patient graph could be integrated with the UMLS KG for LC and thus enable hospitals to bring continuously updated international standard biomedical KGs from the UMLS for clinical use in hospitals. CDR analysis of the graph of patients with LC generated a CDR-sorted distribution of health factors, in which the top CDR-ranked health factors were concordant with the literature. The resulting distribution of LC health factors can be used to help personalize risk evaluation and preventive screening recommendations.					shen, bairong/W-1254-2019	shen, bairong/0000-0003-2899-1531; wen, jian/0000-0002-6370-3964; Chen, Anjun/0000-0003-4209-8301													1438-8871					NOV 25	2022	24	11							e40361	10.2196/40361	http://dx.doi.org/10.2196/40361								36427233					WOS:000965907500002
J	Sirrianni, J; Sezgin, E; Claman, D; Linwood, SL				Sirrianni, Joseph; Sezgin, Emre; Claman, Daniel; Linwood, Simon L.			Medical Text Prediction and Suggestion Using Generative Pretrained Transformer Models with Dental Medical Notes	METHODS OF INFORMATION IN MEDICINE												Background Generative pretrained transformer (GPT) models are one of the latest large pretrained natural language processing models that enables model training with limited datasets and reduces dependency on large datasets, which are scarce and costly to establish and maintain. There is a rising interest to explore the use of GPT models in health care. Objective We investigate the performance of GPT-2 and GPT-Neo models for medical text prediction using 374,787 free-text dental notes. Methods We fine-tune pretrained GPT-2 and GPT-Neo models for next word prediction on a dataset of over 374,000 manually written sections of dental clinical notes. Each model was trained on 80% of the dataset, validated on 10%, and tested on the remaining 10%. We report model performance in terms of next word prediction accuracy and loss. Additionally, we analyze the performance of the models on different types of prediction tokens for categories. For comparison, we also fine-tuned a non-GPT pretrained neural network model, XLNet (large), for next word prediction. We annotate each token in 100 randomly sampled notes by category (e.g., names, abbreviations, clinical terms, punctuation, etc.) and compare the performance of each model by token category. Results Models present acceptable accuracy scores (GPT-2: 76%; GPT-Neo: 53%), and the GPT-2 model also performs better in manual evaluations, especially for names, abbreviations, and punctuation. Both GPT models outperformed XLNet in terms of accuracy. The results suggest that pretrained models have the potential to assist medical charting in the future. We share the lessons learned, insights, and suggestions for future implementations. Conclusion The results suggest that pretrained models have the potential to assist medical charting in the future. Our study presented one of the first implementations of the GPT model used with medical notes.					Sezgin, Emre/I-7969-2019; Linwood, Simon/L-8804-2014														0026-1270	2511-705X				DEC	2022	61	05/06					195	200		10.1055/a-1900-7351	http://dx.doi.org/10.1055/a-1900-7351		NOV 2022						35835447					WOS:000885386100002
J	Richardson, JE; Rasmussen, LV; Dorr, DA; Sirkin, JT; Shelley, D; Rivera, A; Wu, W; Cykert, S; Cohen, DJ; Kho, AN				Richardson, Joshua E.; Rasmussen, Luke, V; Dorr, David A.; Sirkin, Jenna T.; Shelley, Donna; Rivera, Adovich; Wu, Winfred; Cykert, Samuel; Cohen, Deborah J.; Kho, Abel N.			Generating and Reporting Electronic Clinical Quality Measures from Electronic Health Records: Strategies from EvidenceNOW Cooperatives	APPLIED CLINICAL INFORMATICS												Background Electronic clinical quality measures (eCQMs) from electronic health records (EHRs) are a key component of quality improvement (QI) initiatives in small-to-medium size primary care practices, but using eCQMs for QI can be challenging. Organizational strategies are needed to effectively operationalize eCQMs for QI in these practice settings. Objective This study aimed to characterize strategies that seven regional cooperatives participating in the EvidenceNOW initiative developed to generate and report EHR-based eCQMs for QI in small-to-medium size practices. Methods A qualitative study comprised of 17 interviews with representatives from all seven EvidenceNOW cooperatives was conducted. Interviewees included administrators were with both strategic and cooperative-level operational responsibilities and external practice facilitators were with hands-on experience helping practices use EHRs and eCQMs. A subteam conducted 1-hour semistructured telephone interviews with administrators and practice facilitators, then analyzed interview transcripts using immersion crystallization. The analysis and a conceptual model were vetted and approved by the larger group of coauthors. Results Cooperative strategies consisted of efforts in four key domains. First, cooperative adaptation shaped overall strategies for calculating eCQMs whether using EHRs, a centralized source, or a "hybrid strategy" of the two. Second, the eCQM generation described how EHR data were extracted, validated, and reported for calculating eCQMs. Third, practice facilitation characterized how facilitators with backgrounds in health information technology (IT) delivered services and solutions for data capture and quality and practice support. Fourth, performance reporting strategies and tools informed QI efforts and how cooperatives could alter their approaches to eCQMs. Conclusion Cooperatives ultimately generated and reported eCQMs using hybrid strategies because they determined neither EHRs alone nor centralized sources alone could operationalize eCQMs for QI. This required cooperatives to devise solutions and utilize resources that often are unavailable to typical small-to-medium-sized practices. The experiences from EvidenceNOW cooperatives provide insights into how organizations can plan for challenges and operationalize EHR-based eCQMs.					Richardson, Joshua/OEN-4676-2025; Rasmussen, Luke/NJS-7577-2025	Richardson, Joshua/0000-0003-3066-2673; 													1869-0327					MAR	2022	13	02					485	494		10.1055/s-0042-1748145	http://dx.doi.org/10.1055/s-0042-1748145								35508198					WOS:000790471200002
J	Pan, YC; Wang, CH; Hu, BT; Xiang, Y; Wang, XL; Chen, QC; Chen, JJ; Du, JC				Pan, Youcheng; Wang, Chenghao; Hu, Baotian; Xiang, Yang; Wang, Xiaolong; Chen, Qingcai; Chen, Junjie; Du, Jingcheng			A BERT-Based Generation Model to Transform Medical Texts to SQL Queries for Electronic Medical Records: Model Development and Validation	JMIR MEDICAL INFORMATICS												Background: Electronic medical records (EMRs) are usually stored in relational databases that require SQL queries to retrieve information of interest. Effectively completing such queries can be a challenging task for medical experts due to the barriers in expertise. Existing text-to-SQL generation studies have not been fully embraced in the medical domain. Objective: The objective of this study was to propose a neural generation model that can jointly consider the characteristics of medical text and the SQL structure to automatically transform medical texts to SQL queries for EMRs. Methods: We proposed a medical text-to-SQL model (MedTS), which employed a pretrained Bidirectional Encoder Representations From Transformers model as the encoder and leveraged a grammar-based long short-term memory network as the decoder to predict the intermediate representation that can easily be transformed into the final SQL query. We adopted the syntax tree as the intermediate representation rather than directly regarding the SQL query as an ordinary word sequence, which is more in line with the tree-structure nature of SQL and can also effectively reduce the search space during generation. Experiments were conducted on the MIMICSQL dataset, and 5 competitor methods were compared. Results: Experimental results demonstrated that MedTS achieved the accuracy of 0.784 and 0.899 on the test set in terms of logic form and execution, respectively, which significantly outperformed the existing state-of-the-art methods. Further analyses proved that the performance on each component of the generated SQL was relatively balanced and offered substantial improvements. Conclusions: The proposed MedTS was effective and robust for improving the performance of medical text-to-SQL generation, indicating strong potential to be applied in the real medical scenario.					Xiang, Yang/ABI-7171-2020; Hu, Baotian/AAA-4102-2022; Du, Jingcheng/AAQ-5022-2020; Chen, Qingcai/JVN-1580-2024; Chen, Junjie/HHM-8839-2022; Wang, Xiaolong/AGK-3136-2022	Xiang, Yang/0000-0003-1395-6805; Chen, Junjie/0000-0002-0483-303X; Pan, Youcheng/0000-0002-8270-5455; Wang, Xiaolong/0000-0001-9003-4252; chenghao, wang/0000-0001-8761-1215														2291-9694				DEC	2021	9	12							e32698	10.2196/32698	http://dx.doi.org/10.2196/32698								34889749					WOS:000738596600009
J	Ye, JC				Ye, Jiancheng			The impact of electronic health record-integrated patient-generated health data on clinician burnout	JOURNAL OF THE AMERICAN MEDICAL INFORMATICS ASSOCIATION												Patient-generated health data (PGHD), such as patient-reported outcomes and mobile health data, have been increasingly used to improve health care delivery and outcomes. Integrating PGHD into electronic health records (EHRs) further expands the capacities to monitor patients' health status without requiring office visits or hospitalizations. By reviewing and discussing PGHD with patients remotely, clinicians could address the clinical issues efficiently outside of clinical settings. However, EHR-integrated PGHD may create a burden for clinicians, leading to burnout. This study aims to investigate how interactions with EHR-integrated PGHD may result in clinician burnout. We identify the potential contributing factors to clinician burnout using a modified FITT (Fit between Individuals, Task and Technology) framework. We found that technostress, time pressure, and workflow-related issues need to be addressed to accelerate the integration of PGHD into clinical care. The roles of artificial intelligence, algorithm-based clinical decision support, visualization format, human-computer interaction mechanism, workflow optimization, and financial reimbursement in reducing burnout are highlighted.						Ye, Jiancheng/0000-0003-4143-8423													1067-5027	1527-974X				MAY	2021	28	5					1051	1056		10.1093/jamia/ocab017	http://dx.doi.org/10.1093/jamia/ocab017		APR 2021						33822095					WOS:000648977800023
